Id,Sentence,Categories,Target Party,Specificity,Split
180,To further strengthen our domestic security I announce initiatives that go to that most fundamental of liberties – the right to live without fear of violence.,Assertive,Liberal,,
181,My first announcement as Prime Minister was a new $100 million package to encourage all Australians squarely to confront the ugly truth of violence against women and children in our society.,Assertive-S,Liberal,,
182,"Today I can announce a $64 million commitment to crack down on the trafficking of illegal firearms on our streets, in particular by criminal gangs.",Commissive-A,Liberal,Specific,
183,This will extend the work of our National Anti-Gang Squad in tracking and detecting the illegal guns trade in our cities and regions and locking up those who seek to profit from it.,Assertive-V,Liberal,,
184,And it will build up the forensic and intelligence assets of the Australian Federal Police to better detect incoming shipments of illegal firearms and to go after the criminal syndicates who sell them.,Assertive-V,Liberal,,
185,The Government I lead will live within our means.,Commissive-A,Liberal,Vague,
186,This is not only the prudent thing to do - it is the right thing to do. ,Assertive,Liberal,,
187,There is nothing fair about piling a mountain of debt on the shoulders of our children and grandchildren.,Assertive-V,Liberal,,
188,And it serves as a crucial buffer against external risks and shocks.,Assertive-V,Liberal,,
189,My Coalition team is determined to show the economic leadership to ensure young Australians do not start from behind.,Assertive,Liberal,,
190,That is why I counsel all Australians against a roll of the dice on independents or minor parties.,Assertive,Other,,
191,A vote for anyone other than the Liberal and National Party candidates and there is a risk Australians will next week find themselves with Bill Shorten as Prime Minister - and no certainty at all about their future.,Assertive-V,Labor,,
192,That is why I am urging every Australian to think of this election as if their single vote will determine what sort of government we have after July the 2nd.,Directive,Other,,
193,"We can have the sort of chaotic government we see in Queensland today, with a minority Labor government trapped in policy paralysis.",Assertive-V,Labor,,
194,"Or there is the alternative model of a stable, confident administration under Premier Mike Baird here in New South Wales. ",Assertive-V,Liberal,,
195,Under Premier Baird a strong economy and strong budget position is funding new roads and rail and better health and education services.,Assertive-V,Liberal,,
196,"At this election for our nation’s leadership, I am asking Australians to make a clear choice - back a strong and stable Coalition majority Government that can press ahead with our plan for a stronger new economy.",Directive,Other,,
197,"Our plan will deliver the economic security that enables Australians to fulfil their aspirations as individuals, as families, as communities.",Assertive-V,Liberal,,
198,That is why I am asking my fellow Australians at this election to support our Coalition’s National Economic Plan for a Strong New Economy.,Directive,Liberal,,
199,"This national economic plan will secure Australia’s position for decades to come as a high-wage, first world economy of the 21st Century, with a generous social welfare safety net.",Assertive-V,Liberal,,
200,"That means a thriving business sector, where there is the confidence to create more jobs, where small family enterprises are encouraged to think big – to invest, to innovate, to grow their business and employ other Australians.",Assertive-V,Liberal,,
201,"This means an Australia competing with the world’s best in the hi-tech industries and all the other jobs of the future and a strong sustainable advanced manufacturing sector, sharing in the heavy lifting in our new economy.",Assertive-V,Liberal,,
202,"Our farmers and service industries flourishing like never before, with millions of new customers in the markets of Asia to our north, where half of the world’s middle class will soon reside.",Assertive-V,Liberal,,
203,"And only disciplined financial management can guarantee the long-term funding we need to support the hospitals and schools, the roads, the infrastructure - all the services Australians want and expect from government.",Assertive-V,Liberal,,
204,My fellow Australians we alone have the economic plan our nation needs in these times of opportunity and challenge.,Assertive-V,Liberal,,
205,We have always been a lucky country - but today more than ever we need to make our own luck.,Assertive,Liberal,,
206,Get this right and together Australians will succeed as never before.,Assertive,Liberal,,
